Dmitry Royhman,Rush University Medical Center,uic.edu,508,Not Mentioned,https://scholar.google.com/citations?hl=en&user=IS_mGssAAAAJ
Varsha Suresh Kumar,Rush University Medical Center,rush.edu,500,Lung repair and regeneration,https://scholar.google.com/citations?hl=en&user=4Q_1OV0AAAAJ
Sebastian Pollandt,Rush University Medical Center,rush.edu,499,Neurocritical Care | Epilepsy,https://scholar.google.com/citations?hl=en&user=Axe2fHoAAAAJ
John Higgins,Rush University Medical Center,rush.edu,496,Orthopedic Surgery,https://scholar.google.com/citations?hl=en&user=-EooWJwAAAAJ
Jiajie Yan,Rush University Medical Center,rush.edu,493,cardiac electrophysiology | cardiology | atrial arrhythmia | cardiac biomaterials,https://scholar.google.com/citations?hl=en&user=uDqQSTkAAAAJ
Chien-Ching Li,"Rush University, Department of Health Systems Management",rush.edu,492,Cancer Prevention and Control | Health Disparities | Aging | Health Services Research,https://scholar.google.com/citations?hl=en&user=AwiBn4cAAAAJ
Jeremy Rush,"… Surgery, F. Edward Herbert School of Medicine, Uniformed Services University of the Health …",mail.mil,481,Pediatric Orthopaedic Surgery,https://scholar.google.com/citations?hl=en&user=gdwqj7gAAAAJ
Christopher Ford,Rush University Medical Center,Rush.edu,479,Physical Activity | Alzheimer's disease | Yoga | Nutrition | Chonic disease prevention,https://scholar.google.com/citations?hl=en&user=OTGqg3IAAAAJ
"Shengwei Zhang, Ph.D.","Rush Alzheimer's Disease Center, Rush University Medical Center",rush.edu,477,Neuroimaging,https://scholar.google.com/citations?hl=en&user=ZbyXdH4AAAAJ
Michael J. Kremer,Rush University,Not Mentioned,474,healthcare safety and quality,https://scholar.google.com/citations?hl=en&user=eZSu-mIAAAAJ
Shawna Strickland,Rush University,rush.edu,470,Not Mentioned,https://scholar.google.com/citations?hl=en&user=joHi04wAAAAJ
Sharlet Anderson,Rush University Medical Center,rush.edu,461,Not Mentioned,https://scholar.google.com/citations?hl=en&user=2bq36LYAAAAJ
Chen Yeh,"Biostatistician, Rush University Medical Center",rush.edu,459,Not Mentioned,https://scholar.google.com/citations?hl=en&user=77LpeJgAAAAJ
Krishna Chaitanya Joshi,Rush University Medical Center,rush.edu,456,Neurosciences,https://scholar.google.com/citations?hl=en&user=96P39fgAAAAJ
Matthew DePuccio,Rush University,rush.edu,454,Health Services Research | Implementation Science | Qualitative Methods,https://scholar.google.com/citations?hl=en&user=-o5kO_0AAAAJ
Usman Barlass,"University of Alabama, Rush University Medical Center, University of Minnesota",Not Mentioned,450,Pancreas | Liver,https://scholar.google.com/citations?hl=en&user=4X1VLNIAAAAJ
Bridget A. Makol,Rush University Medical Center,rush.edu,450,clinical psychology | depression | children and adolescents | assessment,https://scholar.google.com/citations?hl=en&user=WzvcvrMAAAAJ
MJ Runa,"Universidade do Minho, Rush University Medical Center",Not Mentioned,449,Not Mentioned,https://scholar.google.com/citations?hl=en&user=lK2F57AAAAAJ
Khatcher O. Margossian,"MD/PhD Student; University of Massachusetts, Amherst and Rush University Medical Center",uchicago.edu,449,Materials Science | Medicine | Polyelectrolytes | Polymer Physics | Self-Assembly,https://scholar.google.com/citations?hl=en&user=d8rx9j8AAAAJ
Oropeza-Almazán Yuriana,Rush University - Dept. Physiology and Biophysics,rush.edu,447,Cardiac cell metabolism | mitochondrial calcium,https://scholar.google.com/citations?hl=en&user=V8UgLGEAAAAJ
Cesar Ochoa-Lubinoff,"Associate Professor of Pediatrics, Rush University Medical Center",rush.edu,437,Autism | Down Syndrome | Angelman Syndrome | ADHD,https://scholar.google.com/citations?hl=en&user=zoVmpJ0AAAAJ
Alexander Joseph Acuña,Rush University Medical Center,case.edu,432,Not Mentioned,https://scholar.google.com/citations?hl=en&user=RMz_r0wAAAAJ
Jeanette Lorme,"Emergency Medicine Resident Physician, Rush University Medical Center",rush.edu,429,Not Mentioned,https://scholar.google.com/citations?hl=en&user=MCMXDqAAAAAJ
"Yajuan, Xiao",Rush University,rush.edu,417,Not Mentioned,https://scholar.google.com/citations?hl=en&user=udgzWS8AAAAJ
"Janet Yarboi, PhD",Rush University Medical Center,rush.edu,415,pediatric psychology | child psychopathology | sickle cell disease | stress | coping,https://scholar.google.com/citations?hl=en&user=AHOnayoAAAAJ
Jagadeesh singh,"Teleradiology solutions ,University of calgary,Rush University medical center",rush.edu,406,Not Mentioned,https://scholar.google.com/citations?hl=en&user=Wgcp-u4AAAAJ
Ke Zhu,"Nankai University, Rush University Medical Center",rush.edu,406,Gene regulation | Diabetes | Kidney disease | Bone development and diseases,https://scholar.google.com/citations?hl=en&user=SSR_QaMAAAAJ
Uddyalok Banerjee,Rush University Medical Center; Option Care Enterprises; The Ohio State University,rush.edu,403,Healthcare Analytics | Computational Drug Delivery | Protein Purification | Artificial Oxygen Carriers | Healthcare Statistics,https://scholar.google.com/citations?hl=en&user=QGC9cpYAAAAJ
Nidhi Madan,Rush University Medical Center,rush.edu,403,Cardiology | Internal Medicine,https://scholar.google.com/citations?hl=en&user=9rjphXAAAAAJ
ashvarya mangla,Rush University Medical Center,rush.edu,398,cardiology,https://scholar.google.com/citations?hl=en&user=SJGSv-cAAAAJ
Shengyuan Luo,Rush University,rush.edu,395,Multiomics | Biomarkers | Drug safety and effectiveness | Hypertension and kidney disease | Electrolytes and arrhythmias,https://scholar.google.com/citations?hl=en&user=J1t_rasAAAAJ
Marcia Pencak Murphy,Rush University Medical Center,Not Mentioned,395,Cardiology | Geriatrics,https://scholar.google.com/citations?hl=en&user=UwyqnEcAAAAJ
Francis Fullam,Rush University Medical Center,Rush.edu,394,Patient Experience / Satisfaction,https://scholar.google.com/citations?hl=en&user=bXNFV78AAAAJ
Gift Ukwuani,Rush University Medical Center Chicago,brgeneral.org,394,Not Mentioned,https://scholar.google.com/citations?hl=en&user=raA_4S4AAAAJ
Ken Tatebe,Rush University,rush.edu,393,Not Mentioned,https://scholar.google.com/citations?hl=en&user=YU_re_4AAAAJ
Ke Lu,Rush University Medical Center,rush.edu,389,osteoporosis | acute liver injury | osteoarthritis，lymphoma,https://scholar.google.com/citations?hl=en&user=Cw8qBxwAAAAJ
Julie Worley,Assistant Professor Rush University College of Nursing,Not Mentioned,387,substance use disorders | prescription drug abuse | psychiatry,https://scholar.google.com/citations?hl=en&user=sUktc9UAAAAJ
Liudmila Romanova,Rush University Medical Center,Not Mentioned,379,Not Mentioned,https://scholar.google.com/citations?hl=en&user=d8EcPkIAAAAJ
Alan Goldberg,Rush University Medical Center,rush.edu,377,Cardiology,https://scholar.google.com/citations?hl=en&user=Pr2GNOMAAAAJ
Vissaagan Gopalakrishnan,"Rush Medical College, Rush University Medical Center",rush.edu,376,radiomics | lymphangioleiomyomatosis | agent based modeling | systems biology | wound infections,https://scholar.google.com/citations?hl=en&user=mKGtW8cAAAAJ
Nicholas A Shepard,Rush University Medical Center,rush.edu,371,Not Mentioned,https://scholar.google.com/citations?hl=en&user=5ngwzDkAAAAJ
Scott Heinrich,"Assistant Professor, Rush University Medical Center",rush.edu,371,Emergency Medicine,https://scholar.google.com/citations?hl=en&user=FXmcWlEAAAAJ
Paul Kent,Rush University,rush.edu,368,medicine | biology | education,https://scholar.google.com/citations?hl=en&user=X6nNxfkAAAAJ
"Kenleigh (Roden-Foreman) McMinn, PhD",Rush University Medical Center,rush.edu,365,PTSD | posttraumatic growth | health disparities | comorbid psychological and physical health …,https://scholar.google.com/citations?hl=en&user=9RRv0nUAAAAJ
Ben Mogni,Rush University,rush.edu,364,Emergency Medicine,https://scholar.google.com/citations?hl=en&user=fAqUK78AAAAJ
palmi shah,Director thoracic radiology Rush University Medical Center,Not Mentioned,357,Not Mentioned,https://scholar.google.com/citations?hl=en&user=ElgO_18AAAAJ
Thea Price,Rush University Medical Center,Rush.edu,354,Burn Surgery | Acute Care | Critical Care | Wound healing | Trauma,https://scholar.google.com/citations?hl=en&user=v_RupAoAAAAJ
Lourdes Figueroa,Rush University Medical Center,rush.edu,353,Biophysics and Physiology,https://scholar.google.com/citations?hl=en&user=teZVOPYAAAAJ
Sara M Hock,Rush University Medical Center,rush.edu,351,Simulation | Assessment,https://scholar.google.com/citations?hl=en&user=6kMZDWwAAAAJ
Thomas F Cunningham,"Medical Student, Rush University",rush.edu,345,clinical research | cardiology,https://scholar.google.com/citations?hl=en&user=G2wGTP4AAAAJ
Hale Thompson,Rush University Medical Center,rush.edu,344,Not Mentioned,https://scholar.google.com/citations?hl=en&user=zLQmgXkAAAAJ
V. Amod Saxena,"Professor, Rush University Medical Center",Not Mentioned,344,Oncology | Radiation Oncology,https://scholar.google.com/citations?hl=en&user=OxSRAHAAAAAJ
Lin Cheng,Rush University Medical Center,rush.edu,333,Not Mentioned,https://scholar.google.com/citations?hl=en&user=I1KspSgAAAAJ
Ramesh kumar Paidi,Research Associate at Rush University Medical Center,rush.edu,332,Neurological Sciences,https://scholar.google.com/citations?hl=en&user=wRFl48UAAAAJ
"Siddhesh R Angle, PhD",Etex Corporation - Carnegie Mellon University - Rush University,Not Mentioned,326,Fracture healing | Tissue Engineering | BMP | Bone Substitute Material,https://scholar.google.com/citations?hl=en&user=-umBIQIAAAAJ
Seema Gandhi,"Rush University Medical Center, Cook County Health System",rush.edu,325,Gastroenterology and Hepatology | Associate Professor of Medicine,https://scholar.google.com/citations?hl=en&user=VblB0GAAAAAJ
Joubert Banjop Kharlyngdoh,Rush University Medical Centre,rush.edu,325,Molecular Biology | Endocrinology-Nephrology | Cancer Biology | Inflammation | Glycosylation,https://scholar.google.com/citations?hl=en&user=ZDSI6LMAAAAJ
Sumeet Dua,"Rush University Medical Center, Chicago, IL",rush.edu,321,Neuroradiology | Head and Neck Imaging | Cancer Imaging,https://scholar.google.com/citations?hl=en&user=0pOCiowAAAAJ
Alan T Blank,Rush University Cancer Center/Midwest Orthopedics at Rush,rushortho.com,320,Orthopedic Oncology | Sarcoma,https://scholar.google.com/citations?hl=en&user=G2PjZFoAAAAJ
Soumya Padala,Rush University,rush.edu,311,Orthodontics,https://scholar.google.com/citations?hl=en&user=Nf6T9u0AAAAJ
Sandeep Goyal,Rush University Medical Center,rush.edu,307,Chemistry and Biochemistry,https://scholar.google.com/citations?hl=en&user=gi2gGY4AAAAJ
Aparna Y,"Post-doctoral fellow, Rush University",Not Mentioned,303,ovarian cancer,https://scholar.google.com/citations?hl=en&user=TV8X-JIAAAAJ
Ramya Gaddikeri,"Assistant Professor of Radiology, Rush University, Chicago.",rush.edu,301,Radiology,https://scholar.google.com/citations?hl=en&user=BR6RFQkAAAAJ
MD Rush,University of Illinois at Chicago,uic.edu,299,Medicinal Chemistry,https://scholar.google.com/citations?hl=en&user=3dOFYfAAAAAJ
Juan C. (JC) Rojas,"Assistant Professor, Rush University",rush.edu,298,Machine Learning | Clinical Informatics | Data Science | Equity,https://scholar.google.com/citations?hl=en&user=XXHTvWEAAAAJ
"Rameshwar Prasad, PhD, CMP, DABSNM",Rush University Medical Center,rush.edu,297,PET/SPECT imaging | System Modeling & Image Reconstruction | Tracer Kinetic Modeling | Dosimetry,https://scholar.google.com/citations?hl=en&user=6xi1QtUAAAAJ
Safa Gursoy,Ankara Yildirim Beyazit University,rush.edu,297,Orthopaedics and Traumatology,https://scholar.google.com/citations?hl=en&user=lG7ODIUAAAAJ
Ahmad F. Hedayat,Rush University Medical Center,rush.edu,293,Pathology,https://scholar.google.com/citations?hl=en&user=ORXda3cAAAAJ
Shannon Halloway,Rush University College of Nursing,rush.edu,292,Not Mentioned,https://scholar.google.com/citations?hl=en&user=mv0JNX8AAAAJ
Jonathan Gustafson,"Instructor, Rush University Medical Center",rush.edu,290,biomechanics | predictive modeling,https://scholar.google.com/citations?hl=en&user=R1-KFIUAAAAJ
Vaskar Das,"Assistant Professor, Anesthesiology Department, Rush University Medical Center",uqconnect.edu.au,286,Pain Mechanism,https://scholar.google.com/citations?hl=en&user=uoob9I8AAAAJ
Marwan Wassouf,Rush University Medical Center,Not Mentioned,283,Not Mentioned,https://scholar.google.com/citations?hl=en&user=s0lsElAAAAAJ
Fawn Cothran,"Assistant Professor, Rush University",rush.edu,282,African American caregivers | Health Disparities | Intervention Development,https://scholar.google.com/citations?hl=en&user=zwOYIDoAAAAJ
Anne Hoffmann,Assistant Professor Rush University,rush.edu,277,fragile x syndrome | autism | language development,https://scholar.google.com/citations?hl=en&user=A8zZrQkAAAAJ
Emily Barker,"OB/GYN resident, Rush University Medical Center",rush.edu,276,Not Mentioned,https://scholar.google.com/citations?hl=en&user=SIcOtogAAAAJ
Emma L. Lucas,Rush University Medical Center,paloaltou.edu,273,Neuropsychology | Behavioral Health | Social Determinants of Health,https://scholar.google.com/citations?hl=en&user=WynQPwQAAAAJ
"Dominika A. Winiarski, PhD",Rush University Medical Center,rush.edu,273,Externalizing behavior | interventions for underserved populations,https://scholar.google.com/citations?hl=en&user=xNTx3NgAAAAJ
Caitlin Fehrenbacher,"RN-BC, Rush University Medical Center",rush.edu,268,pediatric mental health | parent/child relationships | disorders of childhood,https://scholar.google.com/citations?hl=en&user=w3Q9Qf4AAAAJ
Muhammad Shahzad,RUSH University Medical Center,rush.edu,266,Nephrology,https://scholar.google.com/citations?hl=en&user=BMHZl-IAAAAJ
Foyez Mahmud,"Postdoctoral Research Fellow, Rush University Medical Center",rush.edu,263,Oral drug delivery | Biomaterials | Cancer | Diabetes | PK/PD,https://scholar.google.com/citations?hl=en&user=oEV6FXsLqccC
Elaine Chen,"Assistant Professor of Medicine, Rush University Medical Center",rush.edu,262,Pulmonary | Critical Care | Palliative Medicine,https://scholar.google.com/citations?hl=en&user=ExglXK4AAAAJ
Robert Rushing,"Professor of Italian, University of Illinois, Urbana-Champaign",illinois.edu,251,Italian film | Italian cinema | critical theory | genre,https://scholar.google.com/citations?hl=en&user=UGXSmzkAAAAJ
Jason Turner,Rush University Medical Center,rush.edu,247,Healthcare Finance | Healthcare Management | Healthcare Strategy | Community Benefit | Population Health,https://scholar.google.com/citations?hl=en&user=kiOqYTMAAAAJ
Eric Polich,"Resident Physician, Rush University Medical Center",rush.edu,247,Emergency Medicine,https://scholar.google.com/citations?hl=en&user=HLOLfvwAAAAJ
Timothy J Hartman,"Research Coordinator, Rush University Medical Center",rush.edu,246,Orthopaedic Surgery,https://scholar.google.com/citations?hl=en&user=n7vpkYcAAAAJ
Anugraha Rajagopalan,"Post doctoral Research Fellow, Rush University Medical Center",rush.edu,238,Not Mentioned,https://scholar.google.com/citations?hl=en&user=UUEwBUsAAAAJ
Jamie Rush,University of Louisville,louisville.edu,233,Not Mentioned,https://scholar.google.com/citations?hl=en&user=WJZGac0AAAAJ
Samuel Minaker,"Vitreoretinal Fellow, Rush University Medical Center",mail.utoronto.ca,231,Ophthalmology,https://scholar.google.com/citations?hl=en&user=Kut9z2kAAAAJ
M. Ryan Farrell,Rush University Medical Center,rush.edu,231,Genitourinary reconstruction,https://scholar.google.com/citations?hl=en&user=LXONhfsAAAAJ
"Joshua M. DeMott, PharmD, MSc, BCPS, BCCCP",Rush University Medical Center,rush.edu,224,Emergency Medicine | Health Systems Management | Critical Care,https://scholar.google.com/citations?hl=en&user=DfBCE8IAAAAJ
Sungho Lim,Rush University Medical Center,rush.edu,224,Vascular Surgery,https://scholar.google.com/citations?hl=en&user=uIUNlAkAAAAJ
Yixiang Liao,"Assistant Professor, Rush University Medical Center",rush.edu,221,Radiation,https://scholar.google.com/citations?hl=en&user=gk1TN7UAAAAJ
Joanne Miller,Rush  University,rush.edu,219,gerontology | interporfessional education | nursing,https://scholar.google.com/citations?hl=en&user=ZDIzY8QAAAAJ
Matthew John Wood,Rush University Medical Center,rush.edu,218,Immunology | Osteoarthritis,https://scholar.google.com/citations?hl=en&user=-IQ33p0AAAAJ
Gina Piscitello,"Assistant Professor, Rush University",rush.edu,218,clinical medical ethics | palliative medicine,https://scholar.google.com/citations?hl=en&user=c2eRUiMAAAAJ
Darbaz Adnan,Rush University Medical Center,rush.edu,217,Not Mentioned,https://scholar.google.com/citations?hl=en&user=h2VfVlUAAAAJ
NEHA JOSHI,"Assistant Professor of Pediatrics, Rush University",rush.edu,216,Severe asthma | Cystic Fibrosis | Flexible fiberoptic bronchoscopy,https://scholar.google.com/citations?hl=en&user=09qsUhYAAAAJ
Dana Rush,"Research Fellow, University of Strasbourg",Not Mentioned,212,Not Mentioned,https://scholar.google.com/citations?hl=en&user=CnSoV1kAAAAJ
Adrian Mansini,Rush University Medical Center,rush.edu,212,Cancer Molecular Biology,https://scholar.google.com/citations?hl=en&user=cOIY3nUAAAAJ
Uzma Akhtar,Rush University,rush.edu,211,Not Mentioned,https://scholar.google.com/citations?hl=en&user=dNCPyc4AAAAJ
Shohreh Raeisi,"Research Assistant II, Rush University Medical Center",Not Mentioned,208,Not Mentioned,https://scholar.google.com/citations?hl=en&user=PZgTQtgAAAAJ
Kathryn Osborne,"Associate Professor of Nursing, Rush University and Medical Center",rush.edu,206,health policy | health promotion,https://scholar.google.com/citations?hl=en&user=Bk5Pfx0AAAAJ
Sidhartha Mahali,Rush University Medical Center,rush.edu,205,Stem Cell Models of Neurodegeneration,https://scholar.google.com/citations?hl=en&user=3SPTHK4AAAAJ
Erika L. Gustafson,"Postdoctoral Fellow, Rush University Medical Center",rush.edu,205,Community-based mental health | Community health workers | Social determinants of health | Mental health service models,https://scholar.google.com/citations?hl=en&user=CJp-zcYAAAAJ
Danielle Pellack,Rush University Medical Center,rush.edu,203,Not Mentioned,https://scholar.google.com/citations?hl=en&user=bb58BJAAAAAJ
Jaclyn Rushing,"PhD Student, University of Montana",umontana.edu,199,protected area management | outdoor recreation | social justice | human dimensions,https://scholar.google.com/citations?hl=en&user=odSmxnoAAAAJ
Paula Jo Belice,Rush University,rush.edu,190,health literacy | social determinants of health | participatory research,https://scholar.google.com/citations?hl=en&user=-p-bq5kAAAAJ
Michelle Brito,"Resident Physician, Rush University",rush.edu,189,Medicine,https://scholar.google.com/citations?hl=en&user=zjfdmWQAAAAJ
Tafheem Malik,"Neurological Sciences, Rush University Medical Center IL Chicago",Not Mentioned,188,Research,https://scholar.google.com/citations?hl=en&user=otqv-HoAAAAJ
Urmeka Jefferson,"Associate Professor, Rush University",rush.edu,188,Breastfeeding,https://scholar.google.com/citations?hl=en&user=wCLjHGoAAAAJ
Yanina Purim-Shem-Tov,"Associate Professor, Rush University Medical Center",rush.edu,188,Emergency Medicine,https://scholar.google.com/citations?hl=en&user=SnBRviwAAAAJ
Khushboo Gupta,Rush University Medical Centre,rush.edu,188,Nuclear Medicine and PET/CT,https://scholar.google.com/citations?hl=en&user=HGtdxgEAAAAJ
Tania Campagnoli,"Assistant Professor, Rush University Medical Center",cookcountyhhs.org,186,Not Mentioned,https://scholar.google.com/citations?hl=en&user=HvAAVDgAAAAJ
"Lev Elterman, MD","Assistant Professor of Urology, Rush University",rush.edu,185,Female Urology | Voiding Dysfunction | Incontinence | Neuromodulation,https://scholar.google.com/citations?hl=en&user=O3n3EvwAAAAJ
Laura VanPuymbrouck,"Rush University, Department of Occupational Therapy",rush.edu,183,health equity | disability justice | occupational disparity,https://scholar.google.com/citations?hl=en&user=DKDIYS0AAAAJ
Zachary Grelewicz,Rush University,rush.edu,182,Medical Physics | Image guided radiation therapy | brachytherapy,https://scholar.google.com/citations?hl=en&user=5E7nuHQAAAAJ
Billy Nguyen,Rush University Medical Center,rush.edu,181,Neuroscience | Cancer,https://scholar.google.com/citations?hl=en&user=kC-8p2kAAAAJ
Oyedolamu Olaitan,Rush University Medical Center,rush.edu,179,Pancreas Transplant | Kidney Transplant | Transplant Urology | Kidney Cancer,https://scholar.google.com/citations?hl=en&user=SsoDLikAAAAJ
Anthony Perry,"Associate Professor of Internal Medicine, Rush University Medical Center",rush.edu,178,Geriatric Medicine | Care Coordination and Management,https://scholar.google.com/citations?hl=en&user=j5bP0TAAAAAJ
Janet Zayas,Rush University Graduate College,rush.edu,178,Immunology | Microbiology | Wound Healing and Cancer Research,https://scholar.google.com/citations?hl=en&user=uX9CqQMAAAAJ
Monique Reed,"Rush University, College of Nursing",rush.edu,177,Obesity Prevention | African American adolescent girls and …,https://scholar.google.com/citations?hl=en&user=ZGxsfiwAAAAJ
sachin vispute,"Epi Research Coordinator 3, Rush University Medical Center",rush.edu,177,Not Mentioned,https://scholar.google.com/citations?hl=en&user=XDmkjCcAAAAJ
Kyle Bersted,Rush University Medical Center,rush.edu,173,Not Mentioned,https://scholar.google.com/citations?hl=en&user=AxVxm_YAAAAJ
Mary Mckay BS,Rush University Medical Center,Not Mentioned,171,biopsychology | neuroimmunology | neurodegeneration | gene therapy | traumatic brain injury,https://scholar.google.com/citations?hl=en&user=nvc55L4AAAAJ
Teppei Shimasaki,Rush University Medical Center,rush.edu,171,Infectious disease | Antibiotic resistance | Healthcare associated infections | Microbiome,https://scholar.google.com/citations?hl=en&user=yZAUoToAAAAJ
Muhammad Jahanzaib Anwar,Albert Einstein College of Medicine/ Montefiore Medical Center Rush University Medical …,montefiore.org,170,Internal medicine | psychiatry | cancer | gastrointestinal,https://scholar.google.com/citations?hl=en&user=4ODE3B4AAAAJ
David Sholtes,"Assistant Professor of Psychiatry, Rush University Medical Center",rush.edu,170,Psychiatry,https://scholar.google.com/citations?hl=en&user=6GjRqJoAAAAJ
Bhaskar Chetnani,Rush University Medical Center,rush.edu,166,Not Mentioned,https://scholar.google.com/citations?hl=en&user=JN74ZvYAAAAJ
Trevor N Christ,Rush University Medical Center,rush.edu,165,Pharmacy | Hematology | Oncology | Precision Medicine | Genomics,https://scholar.google.com/citations?hl=en&user=bKdDoIEAAAAJ
Waqas Mahmud,Rush university medical center,rush.edu,164,waqas_mahmud@rush.edu,https://scholar.google.com/citations?hl=en&user=k4ioIl0AAAAJ
Jamario Skeete,Rush University Medical Center,rush.edu,162,Cardiovascular Medicine,https://scholar.google.com/citations?hl=en&user=3JAHvIkAAAAJ
Jennifer Westrick,"Library Research Information Specialist, Rush University Medical Center",rush.edu,159,systematic reviews | scoping reviews,https://scholar.google.com/citations?hl=en&user=BNv8WE0AAAAJ
Karen Graham,Rush University,rush.edu,158,Alzheimer's Disease | health disparities,https://scholar.google.com/citations?hl=en&user=AF8N5LEAAAAJ
Tristan J Philippe,Rush University Medical Center,ubc.ca,158,Neurosceince | Bioinformatics | Mental health,https://scholar.google.com/citations?hl=en&user=ai9ABw0AAAAJ
Akeel Beigh,"SKUAST-K , Rush Medical University",skuastkashmir.ac.in,156,Immunopathology Molecular Pathology …,https://scholar.google.com/citations?hl=en&user=rC80p2MAAAAJ
Tianhao Wang,"Assistant Professor, Rush University Medical Center",rush.edu,155,Longitudinal Data Analysis | Survival Analysis | Time Series Analysis | Dimension Reduction,https://scholar.google.com/citations?hl=en&user=Nzc-3rcAAAAJ
Colleen B. Nash,"Assistant Professor of Pediatrics, Section of Infectious Diseases, Rush University Medical …",rush.edu,154,Pediatric Infectious Diseases | Antimicrobial Stewardship | Infection Control,https://scholar.google.com/citations?hl=en&user=XyUPMWgAAAAJ
Chuka Emezue,Rush University College of Nursing,rush.edu,153,Violence prevention | Digital Health | Data & Evidence Synthesis | Mixed Methods | Men & Masculinities,https://scholar.google.com/citations?hl=en&user=vdauwNIAAAAJ
Lynn D Mohr,Rush University College of Nursing,rush.edu,150,Pediatric | Neonatal Wound | Ostomy | Continence,https://scholar.google.com/citations?hl=en&user=_pB2u7oAAAAJ
Penelope Annwen Rush,The University of Tasmania,westnet.com.au,148,Language | Ethics | Logic | Philosophy | Meaning,https://scholar.google.com/citations?hl=en&user=lZnYS1IAAAAJ
Christopher B Knowlton,"Ph.D. Researcher, Rush University Medical Center",rush.edu,148,Biomechanics | Motion Analysis | Knee Replacement | Dance Biomechanics | Interactive Media,https://scholar.google.com/citations?hl=en&user=SMpN94IAAAAJ
Henry L. Feng,Rush University Medical Center,rush.edu,148,Vitreoretinal Surgery,https://scholar.google.com/citations?hl=en&user=NX9MqsAAAAAJ
steve attanasio,Rush University Medical Center,rush.edu,148,Not Mentioned,https://scholar.google.com/citations?hl=en&user=jZeAJJUAAAAJ
KHALED ABOUSHAALA,Rush University Medical Center,rush.edu,147,orthopedic surgery,https://scholar.google.com/citations?hl=en&user=oay4fEsAAAAJ
Margaret Rush Dreker,Seton Hall University| Hackensack Meridian School of Medicine,shu.edu,147,Health Sciences Library | Problem Based Learning | Systematic Reviews,https://scholar.google.com/citations?hl=en&user=j3rNDikAAAAJ
Farzan Vahedifard,Rush University Medical Center,rush.edu,146,Neuropsychiatry | Neuroradiology | Diagnostic Biomarkers,https://scholar.google.com/citations?hl=en&user=J3ZkxZ0AAAAJ
Aditi Mishra,Rush University Medical Center,rush.edu,145,Immunogenetics | Molecular Genetics | Molecular Biology,https://scholar.google.com/citations?hl=en&user=W8qu2nUAAAAJ
"Keyur Parekh, MD","… Professor | Department of Diagnostic Radiology at Rush University Medical Center, Chicago",rush.edu,144,Not Mentioned,https://scholar.google.com/citations?hl=en&user=mJJKD7cAAAAJ
"Joshua Ruff, MD",Rush University Medical Center,rush.edu,144,Emergency Medicine,https://scholar.google.com/citations?hl=en&user=RFoXvQcAAAAJ
