lucas monsaingeon,Cy Cergy Paris university,Not Mentioned,2,Architecture | urbanism | heritage,https://scholar.google.com/citations?hl=en&user=tJNeH3oAAAAJ
Vincent Gauthier,"CY Cergy-Paris Université, Laboratoire SATIE",cyu.fr,2,Electrical engineering | instrumentation | viscoelasticity | sensory analysis,https://scholar.google.com/citations?hl=en&user=DyRqM8kAAAAJ
Sandrine Nyebe,"Docteure, CY Cergy Paris Université, Sciences de l'éducation",etu.u-cergy.fr,1,TIC | Education | Formation | innovation | FLE,https://scholar.google.com/citations?hl=en&user=0VEO5UkAAAAJ
Nouhou Abdoul Massalabi,"Laboratoire BONHEURES, CY Cergy Paris Université",Not Mentioned,1,Not Mentioned,https://scholar.google.com/citations?hl=en&user=6zioi08AAAAJ
Lucas Javaudin,"PhD Student, THEMA, CY Cergy Paris University",cyu.fr,1,transportation economics,https://scholar.google.com/citations?hl=en&user=87OMuJ8AAAAJ
Maha Ben-Fares,CY Cergy Paris University,cyu.fr,1,Not Mentioned,https://scholar.google.com/citations?hl=en&user=8ar4zRAAAAAJ
Ihab Assoun,"PhD student, CY Cergy Paris University",wattandwell.com,Not Mentioned,Fault Tolerant Motor Control | Sensorless Control | FPGA | PMSM | space launch vehicles,https://scholar.google.com/citations?hl=en&user=1XDmr38AAAAJ
Marwa EL YASSI,CY Cergy Paris Université,epmistes.net,Not Mentioned,Not Mentioned,https://scholar.google.com/citations?hl=en&user=JNVNJXYAAAAJ
Boly Yves Doba,"Doctorant en didactique de la géographie, CY Cergy Paris Université",etu.u-cergy.fr,Not Mentioned,Didactique | géographie | migrations | risques | curriculum,https://scholar.google.com/citations?hl=en&user=aYF9FY0AAAAJ
Raphaël Bergoin,"PhD student, ETIS, UMR 8051, ENSEA, CY Cergy Paris Université, CNRS, Center for Brain …",cyu.fr,Not Mentioned,neural networks | artificial intelligence | computational neuroscience,https://scholar.google.com/citations?hl=en&user=J6uIKv4AAAAJ
Ishak Ayad,"Docteur en Mathématiques et informatique, CY Cergy Paris Université",cyu.fr,Not Mentioned,Deep learning and machine learning for …,https://scholar.google.com/citations?hl=en&user=jyAEZpYAAAAJ
Samarth Ghoslya,Sapienza University of Rome/ CY Cergy Paris University: PhD Research Scholar,studenti.uniroma1.it,Not Mentioned,Transportation Planning | Transportation Economics | Discrete choice analysis,https://scholar.google.com/citations?hl=en&user=JkmJ9NMAAAAJ
