Sven Werner,Halmstad University,hh.se,9628,district heating | district cooling | smart cities | smart energy,https://scholar.google.com/citations?hl=en&user=PiqKyv0AAAAJ
Josef Bigun,Halmstad University,hh.se,9373,Feature Extraction | Human Vision | Biometrics | Image Analysis | Computer Vision,https://scholar.google.com/citations?hl=en&user=KIdvOZYAAAAJ
Kutty Selva Nandakumar,"Department of Environmental and Biosciences, FIH, Halmstad University",hh.se,7426,Inflammation | Arthritis | Psoriasis | Bacterial vesicles | Estrogen,https://scholar.google.com/citations?hl=en&user=hgd4sGQAAAAJ
Tom Thomas,"Visiting Professor, Halmstad University",hh.se,6725,Tribology | engineering metrology | contact mechanics,https://scholar.google.com/citations?hl=en&user=VmYf78AAAAAJ
Svante Andersson,"Professor, Halmstad University",hh.se,5917,International entrepreneurship | international marketing | born globals | international new ventures | firm growth,https://scholar.google.com/citations?hl=en&user=vb1eNrEAAAAJ
Walid Taha,Halmstad University,hh.se,4912,Cyber-Physical Systems,https://scholar.google.com/citations?hl=en&user=YGjr_pUAAAAJ
Jonas Gabrielsson,"Professor, Halmstad University",hh.se,4822,Corporate Governance | Ownership | Boards of directors | Entrepreneurship | Innovation,https://scholar.google.com/citations?hl=en&user=Wa5QNTEAAAAJ
Fernando Alonso-Fernandez,"Associate Professor, Halmstad University, Sweden",hh.se,4540,BIOMETRICS | Image Analysis | Pattern Recognition | Computer Vision | Feature Extraction,https://scholar.google.com/citations?hl=en&user=o6B_JIUAAAAJ
Mark Dougherty,"Professor in Information Technology, Halmstad University",hh.se,3961,applied  AI,https://scholar.google.com/citations?hl=en&user=QF5063sAAAAJ
Andreas Ivarsson,"Professor in Psychology, Halmstad University",hh.se,3893,Not Mentioned,https://scholar.google.com/citations?hl=en&user=_f6GytsAAAAJ
Urban Johnson,"Professor psychology and sport & exercise, Halmstad University, Sweden",hh.se,3627,psychology | sport | exercise | injury | rehabilitation,https://scholar.google.com/citations?hl=en&user=k6YRTU8AAAAJ
Mikael Alexandersson,Professor in Education at University of Gothenburg and Halmstad University,hh.se,3265,Learning | digitalisation and cultural changes,https://scholar.google.com/citations?hl=en&user=GRclrRUAAAAJ
Ingela Skärsäter,"Professor in Nursing Science, Halmstad University, School of Health and Welfare, Sweden",hh.se,3247,Digital care | Mental health | Social support,https://scholar.google.com/citations?hl=en&user=ejqsI7MAAAAJ
Karen manley,"Professor of Innovation Science, Halmstad University",hh.se,3203,Not Mentioned,https://scholar.google.com/citations?hl=en&user=pqrNWPwAAAAJ
Prayag Tiwari,"Assistant Professor, Halmstad University, Sweden",hh.se,3087,Artificial Intelligence | Machine Learning | Cognitive Science | Healthcare | Quantum Computing,https://scholar.google.com/citations?hl=en&user=sDnmJ_YAAAAJ
Urban Persson,"Professor in Renewable Energy Systems, Halmstad University",hh.se,2876,District heating and cooling | Energy efficiency | Geographical information systems,https://scholar.google.com/citations?hl=en&user=6SV3ja0AAAAJ
Bertil Hulten,"Affiliated Professor of Marketing, Halmstad University, Sweden",hh.se,2802,Sensory marketing | Branding | Retailing,https://scholar.google.com/citations?hl=en&user=XQjwqH8AAAAJ
Thorsteinn Rognvaldsson,"Professor of Computer Science, Halmstad University",hh.se,2675,Artificial Intelligence | Machine Learning | Bioinformatics | Data Mining,https://scholar.google.com/citations?hl=en&user=wJvtMD0AAAAJ
Magnus Bergquist,Halmstad University / University of Gothenburg,hh.se,2548,Not Mentioned,https://scholar.google.com/citations?hl=en&user=8EWlHSoAAAAJ
Magnus Jonsson,"Professor of Real-Time Computer Systems, Halmstad University, Sweden",hh.se,2439,Real-time and embedded communication | Real-time systems | Wireless Networking | VANET | Industrial communication,https://scholar.google.com/citations?hl=en&user=cDnfRt4AAAAJ
BG Rosen,"Chalmers University, University of Halmstad ",hh.se,2431,Materials | Mechanical engineering | metrology | production engineering,https://scholar.google.com/citations?hl=en&user=_0tCwEkAAAAJ
Cristofer Englund,RISE Mobility and Systems & Halmstad University,ri.se,2381,Cooperative systems | data mining | driver behaviour,https://scholar.google.com/citations?hl=en&user=xstRD04AAAAJ
Klaus Solberg Söilen,"Professor, Halmstad University, Sweden",hh.se,2372,International business | Management | Digital Marketing | Geoeconomics | Industrial Espionage,https://scholar.google.com/citations?hl=en&user=s0cZoRQAAAAJ
Göran Sahlén,"Professor in Biology with a focus on Zoology, Halmstad University",hh.se,2232,Ecology | systematics | genetics of Odonata,https://scholar.google.com/citations?hl=en&user=IWIt79UAAAAJ
Mahdi Fazeli,"Associate Professor, School of Information Technology, Halmstad University",hh.se,1897,Energy Efficient Computing | Embedded Systems | Computer Architecture | Hardware Security and Trust | Reliable Circuits and Systems,https://scholar.google.com/citations?hl=en&user=XeHQnLMAAAAJ
Antonia Liess,Halmstad University,hh.se,1727,ecological stoichiometry | benthos | nutrient cycling | wetlands | brouwnification,https://scholar.google.com/citations?hl=en&user=53v9qzEAAAAJ
Eren Erdal Aksoy,"Associate Professor, Halmstad University",hh.se,1607,Semantic Event Chains | Manipulation Actions | Object-Action Relations | Imitation learning | Semantic Policies,https://scholar.google.com/citations?hl=en&user=2xCdZQcAAAAJ
Ingemar Wictor,Halmstad University,hh.se,1592,International entrepreneurship | Born Globals | Leadership | empowerment,https://scholar.google.com/citations?hl=en&user=WIBojuMAAAAJ
Ahmad Ghazawneh,"Associate Professor, Halmstad University, IT University of Copenhagen",hh.se,1583,Digital Innovation | Platforms and Ecosystems | Digital Economy | Blockchain | Fintech,https://scholar.google.com/citations?hl=en&user=K0Xf7GIAAAAJ
Lars Baath,Halmstad University,hh.se,1561,Not Mentioned,https://scholar.google.com/citations?hl=en&user=aRX0BzsAAAAJ
Yousra Alkabani,"Associate Professor, Halmstad University",hh.se,1555,Hardware security | low power design | embedded systems,https://scholar.google.com/citations?hl=en&user=55SbPigAAAAJ
Carina Ihlström Eriksson,"Professor in Informatics, Halmstad University",hh.se,1520,Digital service innovation | news services | living lab,https://scholar.google.com/citations?hl=en&user=NudqZGwAAAAJ
Charlotte Olsson,Halmstad University,hh.se,1426,Not Mentioned,https://scholar.google.com/citations?hl=en&user=ZF0jbUAAAAAJ
Wojciech Mostowski,Halmstad University,hh.se,1414,formal verification | smart cards | embedded systems,https://scholar.google.com/citations?hl=en&user=dmYvWaAAAAAJ
Martin Lind,Halmstad Uni. & Uppsala Uni.,ebc.uu.se,1358,Biology of Ageing | Non-genetic inheritance | Life history evolution | Phenotypic plasticity,https://scholar.google.com/citations?hl=en&user=o6TQ0OQAAAAJ
Johan Michael Wikman,"Assistant professor, Halmstad University",hh.se,1341,Not Mentioned,https://scholar.google.com/citations?hl=en&user=-lfEUNQAAAAJ
Henrik Florén,"Associate Professor of Industrial Management, Halmstad University, Sweden",hh.se,1234,Management of technology | Management of innovation,https://scholar.google.com/citations?hl=en&user=rFQBW1sAAAAJ
Åsa Andersson,"Professor Biomedicine, Halmstad University",hh.se,1212,autoimmunity | chronic inflammation,https://scholar.google.com/citations?hl=en&user=5bb93FAAAAAJ
Bertil Svensson,"Professor of Computer Systems Engineering, Halmstad University, Halmstad, Sweden",hh.se,1185,Embedded Parallel Computing | Reconfigurable Computing,https://scholar.google.com/citations?hl=en&user=gVc74C8AAAAJ
Urban Bilstrup,Halmstad University,hh.se,1185,Radio systems | artificial intelligence | data communication,https://scholar.google.com/citations?hl=en&user=YkL71asAAAAJ
Slawomir Nowaczyk,"Professor, Center for Applied Intelligent Systems Research, Halmstad University",hh.se,1140,Artificial Intelligence | Machine Learning | Knowledge Representation,https://scholar.google.com/citations?hl=en&user=0ZvlTaoAAAAJ
Rögnvaldur Sæmundsson,University of Iceland; Gothenburg University; Halmstad University,hi.is,1093,Entrepreneurship | Innovation | Technology Management | Medical Innovation,https://scholar.google.com/citations?hl=en&user=yYDY1VsAAAAJ
Lars-Gunnar Franzén,"professor, Halmstad University, Sweden",hh.se,1087,photosynthesis | plant mitochondria | Chlamydomonas | organelle biogenesis,https://scholar.google.com/citations?hl=en&user=jal10SMAAAAJ
Claes Malmberg,"Professor of Science Education, Halmstad university",hh.se,1081,education and sustainable development (ESD … | socioscientific issues (SSI) | citizenship,https://scholar.google.com/citations?hl=en&user=_kyzHFkAAAAJ
Fawzi Halila,"Associate Professor, Halmstad University, Sweden",hh.se,1042,Innovation Management | Business Model Innovation | Product Development,https://scholar.google.com/citations?hl=en&user=mcZDHpMAAAAJ
Johan Thunberg,"Associate Professor, Halmstad University, Sweden",hh.se,1039,Control systems | Multi-agent systems | Optimization | Correspondence problems,https://scholar.google.com/citations?hl=en&user=EG4ZBbcAAAAJ
Ross J. Friel,"Professor (Associate), Halmstad University, Sweden",hh.se,1026,Additive Manufacturing/3D Printing | CAD/CAM/CAE | Aerospace | Hybrid Manufacturing | Materials Analysis,https://scholar.google.com/citations?hl=en&user=FQ5dgtEAAAAJ
Pererik Andreasson,"Senior lecturer, Halmstad University",hh.se,954,Data analysis | Applied Electromagnetics,https://scholar.google.com/citations?hl=en&user=5OuIDX0AAAAJ
David C. Green,Halmstad University,hh.se,952,Materials science | crystal growth | crystal engineering | biotemplating | biominerals,https://scholar.google.com/citations?hl=en&user=ka3723EAAAAJ
Andrea Resmini,"… University and Center for Co-Production, Jönköping Academy, Jönköping University",hh.se,933,information architecture | experience design | game design | place-making | blended spaces,https://scholar.google.com/citations?hl=en&user=SvlA6kkAAAAJ
Jo Smedley,Open University/Cardiff University/Halmstad University,open.ac.uk,932,Learning Through Technology | Knowledge Management | Learner Analytics | Enhancing Employability,https://scholar.google.com/citations?hl=en&user=gIWliEQAAAAJ
Jo Smedley,"Guest Professor of Digital Learning, Halmstad University, Sweden",hh.se,927,Learning Through Technology,https://scholar.google.com/citations?hl=en&user=a-85PZcAAAAJ
Gabriel Awuah,"Professor of Marketing, Halmstad University",hh.se,896,Marketing | internationalization | International entreprenurship | Industrial marketing,https://scholar.google.com/citations?hl=en&user=kYigvkMAAAAJ
Hadi Fanaee-T,"Associate Professor, Docent, Halmstad University",hh.se,887,Tensor Factorization | Time Series | Anomaly Detection | Machine Learning | Data Mining,https://scholar.google.com/citations?hl=en&user=FV3p3scAAAAJ
Vaike Fors,"Professor of Design Ethnography, School of information technology, Halmstad University",hh.se,874,design ethnography | learning | automation | body monitoring | autonomous driving,https://scholar.google.com/citations?hl=en&user=dUggGloAAAAJ
Henrik Gadd,Halmstad University,hh.se,837,District heating | District cooling,https://scholar.google.com/citations?hl=en&user=L0i9OIsAAAAJ
Jonas Rundquist,"Assistant Professor, Halmstad University",hh.se,829,new product development | knowledge integration,https://scholar.google.com/citations?hl=en&user=DBCCagsAAAAJ
Nicholas Wickström,"Associate Professor of Computer systems Engineering, Halmstad University",hh.se,793,biomedical sensing | signal processing,https://scholar.google.com/citations?hl=en&user=BURRr9oAAAAJ
Jeaneth Johansson,"Professor Luleå university of Technology, Halmstad University",ltu.se,780,"""Financial decision-making"" | Entrepreneurship | Innovation | Accounting ""Business model""",https://scholar.google.com/citations?hl=en&user=8Q-swgoAAAAJ
Helge Averfalk,"Senior lecturer, Halmstad University",hh.se,769,District heating,https://scholar.google.com/citations?hl=en&user=Zfj50DIAAAAJ
Karin Weman Josefsson,"PhD, Senior Lecturer Halmstad University",hh.se,759,Sport and exercise psychology,https://scholar.google.com/citations?hl=en&user=yuTUd5AAAAAJ
Henrik Barth,Halmstad University,hh.se,751,Not Mentioned,https://scholar.google.com/citations?hl=en&user=0CwfzygAAAAJ
Onur Dikmen,Halmstad University,hh.se,739,Markov Random Fields | Latent Factor Models | Non-negative Matrix Factorisation,https://scholar.google.com/citations?hl=en&user=820ZxM0AAAAJ
Kobra Etminani (Farzaneh),"Associate Professor in Machine Learning, Halmstad University",hh.se,728,Artificial Intelligence | Machine Learning | Data Mining | Healthcare informatics | Precision Healthcare,https://scholar.google.com/citations?hl=en&user=FJ20RCAAAAAJ
Pia Margareta Johansson,Halmstad university,hh.se,724,health economics | economic evaluations | systematic reviews | public health | innovations,https://scholar.google.com/citations?hl=en&user=Y94SzTAAAAAJ
Kenneth Nilsson,"Senior Lecturer of Electrical Engineering, Halmstad University",hh.se,670,Biometrics | Pattern Recognition | Signal processing | Image Processing,https://scholar.google.com/citations?hl=en&user=DjuEtVkAAAAJ
Adel Younis,"Senior lecturer, Department of Construction & Energy Engineering, Halmstad University",hh.se,662,Civil Engineering | Structural Engineering | Sustainable Construction,https://scholar.google.com/citations?hl=en&user=DOzu6wUAAAAJ
Mohamed H. Eldefrawy,"The School of Information Technology, Halmstad University, Sweden.",hh.se,623,Cybersecurity | IoT Security | Digital Forensics | Machine Learning,https://scholar.google.com/citations?hl=en&user=uIaJUe4AAAAJ
Kristian Widen,Halmstad University,hh.se,620,Not Mentioned,https://scholar.google.com/citations?hl=en&user=qVGlLkcAAAAJ
Maria Åkesson,Halmstad University,hh.se,614,Digital service innovation | ecosystems | platforms | automation,https://scholar.google.com/citations?hl=en&user=X6ZH1h8AAAAJ
Jesper Lund,Halmstad University,hh.se,607,Digital Innovation | Living Lab,https://scholar.google.com/citations?hl=en&user=aANJdnIAAAAJ
Pia Ulvenblad,Halmstad University,hh.se,606,Entrepreneurship | Leadership | Self-leadership | Business Models | Sustainability,https://scholar.google.com/citations?hl=en&user=vxxt8FkAAAAJ
Maya Hoveskog,"Associate Professor of Innovation Management, Halmstad University",hh.se,594,Innovation Management | Sustainable Business Model Innovation | Emerging Economies | Collaborative Networks | Entrepreneurship,https://scholar.google.com/citations?hl=en&user=tFnSo5cAAAAJ
Lars Nordgren,Professor in Health management Halmstad University,hh.se,577,health management | organisation | discourse analysis | public management,https://scholar.google.com/citations?hl=en&user=-bNXZI4AAAAJ
Nina Bergdahl,"PhD Information Society, affiliated with Halmstad University, Stockholm university",dsv.su.se,560,(Dis-)engagement | Learning Design | Educational Technologies | Online Learning | Digitalisation of Education,https://scholar.google.com/citations?hl=en&user=tVNn9o0AAAAJ
Jonas Sjöström,"Associate Professor in Information Systems, Halmstad University",hh.se,550,information systems design | software architecture | software processes | design science research | information systems didactics,https://scholar.google.com/citations?hl=en&user=tWyIBd4AAAAJ
Pontus Wärnestål,"Associate Professor, Halmstad University",hh.se,502,artificial intelligence | user experience design | service design | human-computer interaction | language technology,https://scholar.google.com/citations?hl=en&user=kFio8OQAAAAJ
Kalle Jonasson,Halmstad University,hh.se,495,Sport studies | Cultural Geography | Childhood Studies | Continental Philosophy | Digital Humanities,https://scholar.google.com/citations?hl=en&user=3FGtjQ4AAAAJ
Jonathan R. Burgos,Research Coordinator at Halmstad University,hh.se,487,Feeding Behaviour | Real-World Evidence,https://scholar.google.com/citations?hl=en&user=XXcMQJMAAAAJ
Mohamed-Rafik Bouguelia,"Associate Professor, Center for Applied Intelligent Systems Research, Halmstad University …",hh.se,477,Machine Learning | Data Mining | Artificial Intelligence | Data Science,https://scholar.google.com/citations?hl=en&user=YXM_FmgAAAAJ
Sara Svensson,"Halmstad University, Sweden",hh.se,477,cross-border cooperation | policy analysis | collaborate governance | civil society | solidarity,https://scholar.google.com/citations?hl=en&user=OPtAf9AAAAAJ
Per-Ola Ulvenblad,Halmstad University,hh.se,452,Business models innovation sustainability …,https://scholar.google.com/citations?hl=en&user=9GEWZWcAAAAJ
Zain ul-Abdin,Halmstad University,hh.se,448,Manycores | Reconfigurable Computing | Parallel Programming | Dataflow Programming,https://scholar.google.com/citations?hl=en&user=pOB8mx8AAAAJ
rajvi pandav,halmstad university,Not Mentioned,436,international marketing,https://scholar.google.com/citations?hl=en&user=fD4shHcAAAAJ
SADI ALAWADI,"Assistant Professor of Machine Learning at Halmstad University, Sweden",hh.se,398,Machine learning | federated learning | transfer learning and interactive learning | IOT | Dimensional reduction and data visulizati,https://scholar.google.com/citations?hl=en&user=dIeR3oAAAAAJ
Mohsen Soleimani-Mohseni,"Senior Lecturer, Halmstad University",hh.se,392,Energy in Buildings | Building Physics | HVAC | Solar Energy,https://scholar.google.com/citations?hl=en&user=cUs-D_MAAAAJ
Kristina Lygnerud,"Swedish Environment Research Institute, IVL and Halmstad University",ivl.se,392,Business model innovation in energy,https://scholar.google.com/citations?hl=en&user=7WYyQb8AAAAJ
Mohamed Abuella,Halmstad University,uncc.edu,376,Solar Energy | Energy Analytics | Renewable Integration | Smart Grid,https://scholar.google.com/citations?hl=en&user=nJbFUkcAAAAJ
Markus Lingman,"Sahlgrenska academy, Halmstad University",gu.se,368,Not Mentioned,https://scholar.google.com/citations?hl=en&user=wV8yJuwAAAAJ
Krister Hertting,Halmstad University,hh.se,366,Not Mentioned,https://scholar.google.com/citations?hl=en&user=bFjBKqEAAAAJ
Fredric Ottermo,"Associate professor in energy engineering, Halmstad University",hh.se,364,wind power | energy engineering,https://scholar.google.com/citations?hl=en&user=sDYUDwcAAAAJ
Emil J Nilsson,Electrical Engineering Halmstad University,hh.se,354,Not Mentioned,https://scholar.google.com/citations?hl=en&user=bnabBV4AAAAJ
Summrina Kanwal,"Researcher, Halmstad University",hh.se,348,Machine Learning Medical Image Analysis | CDSS,https://scholar.google.com/citations?hl=en&user=5ql36_4AAAAJ
Sepideh Pashami,"Senior Lecturer, Halmstad University",hh.se,324,Data Mining | Machine Learning | Causal Inference,https://scholar.google.com/citations?hl=en&user=dP8O7_AAAAAJ
Martin Cooney,"Senior Lecturer, Halmstad University",hh.se,323,Social Robotics | Human Robot Interaction | Affective Robotics,https://scholar.google.com/citations?hl=en&user=62CzxzUAAAAJ
Eva Berggren,Halmstad University,hh.se,309,academic entrepreneurship | student and alumni entrepreneurs,https://scholar.google.com/citations?hl=en&user=Fovu8JEAAAAJ
Max Waltman,"Assistant Professor, Halmstad University, Department of Political Science; School of …",hh.se,305,Violence Against Women | Feminist Theory | Civil Rights | Human Trafficking | Intersectionality,https://scholar.google.com/citations?hl=en&user=wYC4dMIAAAAJ
Niklas PE Karlsson,"Assistant Professor, Halmstad University",hh.se,291,Biogas | Business models | Corporate Sustainability | Innovation,https://scholar.google.com/citations?hl=en&user=KgeEiXwAAAAJ
Erik Möllerström,"Senior lecturer in Energy Engineering, Halmstad University",hh.se,291,wind power | wind energy | vawt,https://scholar.google.com/citations?hl=en&user=1LH1IKEAAAAJ
Marie Lydell,Halmstad University,hh.se,284,Health promotion | working life,https://scholar.google.com/citations?hl=en&user=qEvCOhIAAAAJ
Emilia Aldrin,Halmstad University / Högskolan i Halmstad,aldrins.se,262,socio-onomastics | sociolinguistics,https://scholar.google.com/citations?hl=en&user=ZnwVMF8AAAAJ
Pablo Picazo-Sanchez,"Assistant Professor, Halmstad University",chalmers.se,259,Systems Security,https://scholar.google.com/citations?hl=en&user=xGvb82MAAAAJ
Harrison John Bhatti,"PhD candidate, Halmstad University; Research assistant, VTI Gothenburg, Sweden.",student.hh.se,256,Smart Grid | Renewable Energy Management System | Innovation Management | Cloud Computing | Business Model Innovation,https://scholar.google.com/citations?hl=en&user=t81lTLgAAAAJ
Eugenia Perez Vico,"Associate professor, Halmstad University",hh.se,248,Innovation studies | Research impact | Academic engagement | Innovation systems | Transition studies,https://scholar.google.com/citations?hl=en&user=YoI9awUAAAAJ
Mohammad Saeid Atabaki,"… Position, School of Business, Innovation and Sustainability, Halmstad University",hh.se,248,Energy Systems Modeling | Circular Economy | Supply Chain Management | Robust Optimization | Evolutionary Algorithms,https://scholar.google.com/citations?hl=en&user=BiAEnsUAAAAJ
Ludvig Lindlöf,"Senior Lecturer, Halmstad University",hh.se,223,R&D management,https://scholar.google.com/citations?hl=en&user=afFR8xkAAAAJ
Masoumeh Taromirad,Halmstad University,hh.se,214,Model-Based Testing | Model Driven Engineering | Agile Software Development,https://scholar.google.com/citations?hl=en&user=vpyZSPgAAAAJ
Tiago Cortinhal,"PhD Student, Halmstad University",hh.se,208,Computer Vision | Deep Learning | Generative Models | Autonomous Vehicles,https://scholar.google.com/citations?hl=en&user=mQFOkfcAAAAJ
"John Lindgren, PhD",Halmstad University,hh.se,206,Not Mentioned,https://scholar.google.com/citations?hl=en&user=59Mu4IMAAAAJ
Parivash Pirasteh,Halmstad University,hh.se,200,Data mining | Machine Learning | Recommender Systems | Predictive Maintenance,https://scholar.google.com/citations?hl=en&user=Kw4Mdx0AAAAJ
Yuantao Fan,Halmstad University,hh.se,198,Data Mining | Artificial Intelligence | Machine Learning | Vehicle Diagnostics,https://scholar.google.com/citations?hl=en&user=fYO4ymAAAAAJ
Robert Ågren,Halmstad University,thefrown.net,197,public procurement | contract design | law and economics,https://scholar.google.com/citations?hl=en&user=bjXpyLMAAAAJ
Dimitrios Gkouskos,Assistant Professor at Halmstad University,hh.se,180,Design Methods | Design Research | User Experience | Design for Sustainability,https://scholar.google.com/citations?hl=en&user=Zfbz4OwAAAAJ
Wagner Ourique de Morais,"Senior Lecturer, Halmstad University",hh.se,175,Ambient Intelligence | Smart Environments | Smart Homes | Ambient Assisted Living,https://scholar.google.com/citations?hl=en&user=CN52IHcAAAAJ
Maria Luiza,Halmstad University,hh.se,175,Not Mentioned,https://scholar.google.com/citations?hl=en&user=-46MQ8IAAAAJ
Awais Ashfaq,Region Halland; Halmstad University,hh.se,158,Deep learning | Healthcare,https://scholar.google.com/citations?hl=en&user=Xp3xsG8AAAAJ
Anders Billström,"PhD, University of Skövde, Halmstad University",his.se,144,Entrepreneurship | Academic Entrepreneurship | Management | Teams | University spin-offs,https://scholar.google.com/citations?hl=en&user=b8KLeacAAAAJ
Navid Ghannad,"Assistant professor, Halmstad University",hh.se,136,Entrepreneurship | International marketing,https://scholar.google.com/citations?hl=en&user=gu2SAE8AAAAJ
Susanne Lindberg,"Halmstad University, Sweden",hh.se,133,Information Systems | HCI | IxD,https://scholar.google.com/citations?hl=en&user=6kTw8VMAAAAJ
Olga Rauhut Kompaniets,"Halmstad University, PhD, Senior lecturer in Marketing and Business Administration",hh.se,133,Marketing | Place Marketing | Destination Marketing | Tourism Marketing | Wine Marketing,https://scholar.google.com/citations?hl=en&user=87Wx3mkAAAAJ
Abbas Orand,Halmstad University,hh.se,128,Biomedical Engineering | Signal Processing | Rehabilitation | Machine Learning | Artificial Intelligence,https://scholar.google.com/citations?hl=en&user=kwrOFEAAAAAJ
Quentin Delooz,"Research Associate, Hochschule Ingolstadt | PhD student, Halmstad University",carissma.eu,127,V2X | Collective Perception,https://scholar.google.com/citations?hl=en&user=8vgkeQEAAAAJ
Yahya Ghasemi,PhD. senior lecturer in Halmstad university,hh.se,125,Mix design | aggregate | Specific surface area | water layer theory | particle packing,https://scholar.google.com/citations?hl=en&user=QsCpHt8AAAAJ
Lars-Olof Johansson,"Phd in Informatics, Halmstad University, University West",hh.se,123,Digital services and practice theory,https://scholar.google.com/citations?hl=en&user=AvogPI8AAAAJ
Ece Calikus,"Postdoc, Halmstad University & TU Kaiserslautern",hh.se,123,data mining | machine learning,https://scholar.google.com/citations?hl=en&user=e4OV2-sAAAAJ
Petter Eklund,Halmstad University,hh.se,120,electrical machines | permanet magnets | renewable power generation,https://scholar.google.com/citations?hl=en&user=M3cwofMAAAAJ
Peter A. Lutz,Halmstad University,hh.se,118,Anthropology | Care | Design | Science Technology Studies | STS,https://scholar.google.com/citations?hl=en&user=Z2E0SisAAAAJ
Hazem Ali,"Assistant Professor, CERES Department, Halmstad University",hh.se,113,IoT | Parallel Computing | Real-time Systems | Dataflow Languages | Parallel Programming,https://scholar.google.com/citations?hl=en&user=UniFYZUAAAAJ
Fábio Gama,Halmstad University,hh.se,112,Artificial intelligence | Healthcare | Innovation processes | Digital innovation,https://scholar.google.com/citations?hl=en&user=tzR5R70AAAAJ
Amira Soliman,"Assistant Professor at Center for Applied Intelligent Systems Research, Halmstad University",hh.se,109,Healthcare Informatics | Graph Analysis | Federated Learning | Decentralized Computing,https://scholar.google.com/citations?hl=en&user=YkaxvCwAAAAJ
Lena Petersson,"Assistant professor of Pedagogy, Halmstad University",hh.se,108,Not Mentioned,https://scholar.google.com/citations?hl=en&user=cmTruzsAAAAJ
